week_start_date,week_end_date,review_id,title,text,date,program_tag
2025-10-20,2025-10-26,922235a7-0303-4982-9667-928d14016271,,interface and easy to use .but bigger issue you don't know what is your real blance . blance cut automatically and many charges.very bad app too many charges and no blance clearty blance manipulation according to your team so beavair,2025-10-21 14:57:05,com.nextbillion.groww
2025-10-20,2025-10-26,697bb0b2-e739-4e9f-bb84-5299e35c920b,,Bad customer service Whenever you get problem about app they not reply you quickly Today I got bad experience not got Tpin I can't send my shares for one hour I send chat message about that but 30 minutes no reply from customer care survive That's really dangerous now grow taking that High charges if you sell same share in same days but in different time grow will take many times dp charges 15 rupees that's dangerous for traders,2025-10-21 14:12:49,com.nextbillion.groww
2025-10-20,2025-10-26,fb03eb1e-10c3-45f1-bfa1-fae45e6907e4,,itna ghatiya payment system hai inka issey acha dhan me account open krlena isme mat krna na time pe profit account me add krte hai next day se pehle withdrawal ni kr skte comodity me 10 bje tak trade le skte hai expiry pe bawaseer application hai bilkul,2025-10-21 13:57:56,com.nextbillion.groww
2025-10-20,2025-10-26,9791a536-67a3-48c6-8164-8bf4502b2f58,,"The groww app looks good to use(for attract new customers)but not good from the inside, app support is purely 3rd class, I tried again and again to solve my problem, the agent did not answer my question but answered other questions with chat, after some time the agent ended the chat without solving my problem.and there is a problem if you buy digital gold before, right now you can't access it,or any one want to buy digital gold there is no option to buy. don't use this app.",2025-10-21 12:13:46,com.nextbillion.groww
2025-10-20,2025-10-26,a367a493-ba7b-4cea-87c0-2f6dfb44c999,,"Dude, I have already Invested in Stock's from your app and I don't have any money left to Invest more. I am seeing too many of your ad getting wasted on me on YouTube. Please don't waste your precious money. I seriously starting to question your sustainability If you're keep wasting your ads on me instead of getting new customers.",2025-10-21 11:55:52,com.nextbillion.groww
2025-10-20,2025-10-26,fabffdbb-c8ca-490a-aa11-c615d00ec787,,"Best options to see in this app, compared to other apps in this trading, really good to use easy to use and easy to understand and safest",2025-10-21 10:47:57,com.nextbillion.groww
2025-10-20,2025-10-26,1fdca895-6307-4ba3-9572-ede8660aaf31,,very worst app kindly do not trust ever the result of roi they shows on there application poor service I recommend you never ever use this poor app,2025-10-21 10:41:30,com.nextbillion.groww
2025-10-20,2025-10-26,17192edb-c106-4241-bb9d-1a305b55c4b2,,इटरफस अचछ ह कसटमर सपरट भ अचछ ह लकन एक कम ह ज हर टरजकशन पर लगन वल शलक और बरकरज श नह ह रह ह ऐप म उसक दखन क लए सटटमट चक करन पडत ह उसम सधर कय जए और डयरकटर ऐप म ह बरकरज और अदर गवरनमट शलक श हन चहए,2025-10-21 10:31:51,com.nextbillion.groww
2025-10-20,2025-10-26,3d9ea914-1e5c-45f9-80df-970ecb3302a5,,I am using the groww platform for the past 3 years and the interface is so simple and easy to use The only feedback I would like to give is to add a portfolio overlap calculator for the mutual funds section which would help the investors about understanding portfolio diversification in a much better and transparent way please add this enhancement for the next release versions ...,2025-10-21 09:58:11,com.nextbillion.groww
2025-10-20,2025-10-26,0b03e57d-281d-498a-9cf9-ca19f9c8887f,,I have been using this qpp from 2 yrs but i am totally unsatisfied with their service they have started commodity with no process to see profit and loss and their champ are saying to see contract notes but they will not do anything to improve groww,2025-10-21 09:13:28,com.nextbillion.groww
2025-10-20,2025-10-26,0738a49f-521e-41f3-a3c2-376cd5c8236b,,I compared all broker for brokerage charges and found groww is the worst one for Mtf .....you are charging brokerage 0.1 % which is too much as compared to other i.e.20order.... I was using groww for last 4 year but now I will switch to other.... worst worst for mtf,2025-10-21 07:34:25,com.nextbillion.groww
2025-10-20,2025-10-26,31eea954-bada-46f3-aba0-e689ada7ffb5,,ipo ka allotment resio ismain only 10 %hai bahut kam hote hai allotment isse better app angel one hai usmain mera 1 bid chodkar sare ipo mujhe alloted hue hai,2025-10-21 07:32:58,com.nextbillion.groww
2025-10-20,2025-10-26,2fbde560-ba49-4cbf-aa8a-5c16acde4167,,it's very convenient for those who have no much knowledge on mutual funds and SIPs..The best part is the process is too easy and quick.. Try making it more simple eliminating the implied steps in the process,2025-10-21 07:00:21,com.nextbillion.groww
2025-10-20,2025-10-26,83c5ea82-c3de-4139-8704-fced97cd1315,,qw qqqwq ki photo kaun bhaiya good qqqq qq q it hi bhaiya good night friends ji sir q ki photo si q it qqhi qlagai hai q q it qqhi q,2025-10-21 01:54:39,com.nextbillion.groww
2025-10-20,2025-10-26,fabe1a4f-1dfc-49c9-82e3-945e3b5d3192,,this app can't use for user it's charged is very High according to me not sagusted. it's application is very slow sometimes can't download this it's My opinion,2025-10-20 23:39:25,com.nextbillion.groww
2025-10-20,2025-10-26,a3931030-1771-4cae-a6d0-90f78f1e4795,,worst trading app or broker in the world. . groww is not a broker . it is robber of traders and investors. don't use this app for trading or investing purpose.,2025-10-20 19:08:37,com.nextbillion.groww
2025-10-20,2025-10-26,bc31f407-dc14-46fe-9f1e-115034b6281d,,"It would be nice if they add option of top gainer and loser of the week, month and year. and also trading commodities, international stocks, crypto, betting on sports...etc",2025-10-20 19:02:40,com.nextbillion.groww
2025-10-20,2025-10-26,a705a2d5-b83a-46ea-b1b0-104cc4ae28e3,,I feel like the app is nearly perfect for trading but you would still need another app to buy US stocks and it doesn't provide the service of dividing stocks therefore you would always need to buy the given amount of whole stocks and not fractional stocks,2025-10-20 16:23:04,com.nextbillion.groww
2025-10-20,2025-10-26,ac00268a-be93-4e7a-a7b0-405789256c73,,"This App is worst, and lagging too much , At time when I downloaded this app, this was my bestest choice, but now this is my worst choice, You know, when Iam click to exit profit, it simultaneously sold in loss, also you don't update chart patterns, if you update chart patterns, you don't update loss or profit, which coming in my portfolio, you know, this all problems is not only for f&o and intraday, This problems is for all stocks which is for buy and sell, And you removed oi system",2025-10-20 15:54:18,com.nextbillion.groww
2025-10-20,2025-10-26,3e5d26bc-bcc7-4469-8105-47ea6f83b21f,,After last update Stock price doesn't show up in F&O positions. Also stop giving automated replies here.,2025-10-20 14:14:55,com.nextbillion.groww
2025-10-20,2025-10-26,3ee8a647-e302-43ac-8983-7567af478e34,,"A member of groww since 2019 and in these 6 years, apart from a glitch that happened recently, I don't remember any problems that I have encountered. a good app, easy to use, understand",2025-10-20 13:55:42,com.nextbillion.groww
2025-10-20,2025-10-26,8651344b-244d-4ba3-8783-642df57c6f7f,,too delays withdrawal when it's time to deposit it's superfast they said instant withdrawal but that's not the fact it's scam i will not promote any of my student or any other person worst broker,2025-10-20 11:41:08,com.nextbillion.groww
2025-10-20,2025-10-26,db78d8c5-a980-441c-bd7d-9988899ef073,,"one thing which needs to be fixed is when we sell at options the exit takes time, in past it was quick sell at current price but in current when we sell it takes 2-3 seconds to sell while the price gets changed.",2025-10-20 11:36:23,com.nextbillion.groww
2025-10-20,2025-10-26,cd22554a-1be9-4096-bab4-6187c0040692,,zerodha and dhan mobile app give features multiple chart open but why grow doesn't give multiple chart open at a same time in mobile app,2025-10-20 08:55:09,com.nextbillion.groww
2025-10-20,2025-10-26,00394f85-2230-4cca-89d9-1ef17b83ef22,,very poor service of groww app.i want to withdraw money from wallet but Amount not withdraw after 3 days passed.when i made deposit why amount deducted in 5 second ?when i want to connect with customer care but no anyone pick the call untill wait 15 minute.,2025-10-20 07:46:03,com.nextbillion.groww
2025-10-20,2025-10-26,a8844c6f-029d-4d63-8fca-dda67fc149d8,,Groww app is excellent and easy for trade and investment. I request groww app to open its own Ethical fund and etf sharia bees.,2025-10-20 07:25:30,com.nextbillion.groww
